Sudipta Sarkar,"Professor, Department of Civil Engineering, Indian Institute of Technology Roorkee, India",25,43,2997,Indian Institute of Technology Roorkee,Water Treatment,Environmental Engineering
Tanmay Basak,"Professor, Chemical Engineering, Indian Insttitute of Technology Madras",51,184,11434,Indian Institute of Technology Madras,Heat Transfer,Fluid Dynamics
Udayan Guha,"Senior VP, Clinical and Translational Development, NextCure Inc; Senior Clinical Advisory Staff, NCI",33,47,4240,NextCure Inc,Cancer Immunotherapy,Translational Medicine
Abhirup Sarkar,"Professor of Economics, Indian Statistical Institute",12,12,785,Indian Statistical Institute,Development Economics,Public Economics
Amit Chakraborty,Master in computer applications,55,253,13570,Indian Statistical Institute,Algorithms,Computational Complexity
Amitava Mukherjee,"Senior professor and Ex-Director, Centre for Nanobiotechnology, VIT University",78,351,24313,VIT University,Nanobiotechnology,Nanomedicine
Anindya Chatterjee,"Professor, Department of Mechanical Engineering, Indian Institute of Technology, Kanpur",34,82,7535,Indian Institute of Technology,Kanpur,Vibrations and Dynamics
Dr. Anirban Bhattacharya,"Associate Professor, Mechanical Engineering Department, Indian Institute of Technology Patna",30,60,3380,Indian Institute of Technology Patna,Fluid Mechanics,Heat Transfer
Arijit Karati,"Assistant Professor, National Sun Yat-sen University",14,21,1111,National Sun Yat-sen University,Cybersecurity,Cryptographic Protocols
Arindam Dey,Research Scientist @ Meta Reality Labs | Adjunct Research Fellow @ UQ,28,42,2979,Meta Reality Labs,Human-Computer Interaction,Augmented Reality
Ashok K. Mishra,"Kemper and Ethel Marley Foundation Chair, ASU Tempe, AZ",68,240,15920,Arizona State University,Agricultural Economics,Water Resource Management
Babita Sharma,"PhD Scholar at Singhania University, Rajasthan, India",35,125,6319,Singhania University,Biotechnology,Environmental Science
Basudev Majumder,"Faculty, Department of Avionics, IIST, Trivandrum",13,17,619,Indian Institute of Space Science and Technology (IIST),Avionics,Spacecraft Systems
Bharati Basu,"Professor of Economics, Central Michigan University",11,11,341,Central Michigan University,Environmental Economics,Health Economics
Prof. (Dr.) Biswanath Mondal,"Former Professor & Chief Scientist, AcSIR /Centre for Advanced Materials Processing, CSIR-CMERI",33,65,4082,CSIR-Central Mechanical Engineering Research Institute (CMERI),Advanced Materials Processing,Materials Science
Debashis Mandal,"Principal Scientist & ICAR-National Fellow, ICAR-IISWC",31,99,3776,ICAR-IISWC,Soil and Water Conservation,Sustainable Agriculture
Debatosh Guha,"Institute of Radio Physics & Electronics, Calcutta University",40,79,5082,University of Calcutta,Antenna Design,Microwave Engineering
Dipak Kumar Jana,"Principal at Gangarampur College, Former HOD at SAS&H, Professor, Haldia Institute of Technology",29,65,2346,Haldia Institute of Technology,Environmental Science,Sustainable Development
Dipankar Sarkar,National Geophysical Research Institute,27,49,2472,National Geophysical Research Institute,Geophysics,Seismology
Dr Ganesh Chandra  Nayak,Associate Professor,37,82,3594,Sambalpur University,Materials Science,Nanotechnology
Gourab Banerjee,Yale University,12,12,1184,Yale University,Electrical Engineering,Photonics
Indrajit Chakrabarti,"Professor, Dept. of Electronics and Electrical Communication Engineering, IIT Kharagpur",21,52,1459,Indian Institute of Technology Kharagpur,Signal Processing,Image Processing
Md Jahangir Alam,"Researcher, CRIM",67,437,23188,CRIM,Natural Language Processing,Artificial Intelligence
Jayanta Bhattacharya,Indian Institute of Technology Kharagpur,42,119,8920,Indian Institute of Technology Kharagpur,Signal Processing,Communications
Joydeep Banerjee,"Assistant Professor, Department of Agricultural and Food Engineering, Indian Institute of Technology",17,22,1117,Indian Institute of Technology,Agricultural Engineering,Food Processing Technology
Kaushik Kumar Bharadwaj,Research Scholar,12,14,717,Research Scholar,Artificial Intelligence,Data Science
Kalyan Kumar Chattopadhyay,"Professor, Jadavpur University",65,340,16124,Jadavpur University,Materials Science,Nanotechnology
Prasanta Kumar Das,"Associate Professor, Department of Physics, BITS Pilani, K.K.Birla Goa Campus",92,452,30286,BITS Pilani,Condensed Matter Physics,Quantum Mechanics
"Dr. Narendra Nath Ghosh, FRSC","Professor, Dept of Chemistry, BITS Pilani, KK Birla Goa Campus",39,103,6988,BITS Pilani,Materials Chemistry,Nanotechnology
rakesh pandey,"Professor in Physics, K M College, Delhi University",4,2,70,Delhi University,Condensed Matter Physics,Quantum Mechanics
Dr. K. N. Das,"Professor of Soil Science, Assam agricultural University",11,14,394,Assam Agricultural University,Soil Science,Agricultural Research
K N Rai,"Institute Professor, IIT BHU Varanasi India",29,69,2626,IIT BHU Varanasi,Thermal Engineering,Heat Transfer
Prof. Kalyan Kumar Das,Jadavpur University,31,125,5821,Jadavpur University,Condensed Matter Physics,Materials Science
Kalyanmoy Deb,"University Distinguished Professor, Electrical and Computer Engineering, Michigan State University",145,647,216104,Michigan State University,Evolutionary Computation,Multi-objective Optimization
Karabi Biswas,"Professor, Indian Institute of Technology Kharagpur",29,56,3149,Indian Institute of Technology Kharagpur,Power Electronics,Renewable Energy Systems
Kaustubha Mohanty,"Professor and Head of Chemical Engineering, IIT Guwahati",59,172,11249,Indian Institute of Technology Guwahati,Chemical Engineering,Process Systems Engineering
Krishan Kumar,Student at Carleton University,109,1023,67818,Carleton University,Artificial Intelligence,Data Science
Kuldeep Kumar Sharma,ICAR-IIMR,47,269,10032,ICAR-IIMR,Maize Breeding,Abiotic Stress Tolerance
Kunal Pal,National Institute of Technology Rourkela,56,193,11305,National Institute of Technology Rourkela,Biomedical Engineering,Signal Processing
Lalit Mohan Patnaik,"Adjunct Professor and NASI(National Academy of Sciences India)Senior Scientist, NIAS,Bangalore,India",42,204,16771,National Institute of Advanced Studies (NIAS),Evolutionary Computation,Neural Networks
M.K. Walz,Professor der Medizin,65,165,16968,Universität Witten/Herdecke,Endocrine Surgery,Minimally Invasive Surgery
Mrinal K. Ghose,"Professor of Environmental Science & Engineering, Indian School of Mines, Dhanbad",43,124,6586,Indian School of Mines,Dhanbad,Environmental Science
Manoj Kumar Tiwari,"Director, Indian Institute of Management Mumbai,India &Prof.of ISE,IIT KGP",89,336,35395,Indian Institute of Management Mumbai,Supply Chain Management,Operations Research
Rajeshwar Malavath,Professor Jayashankar Telangana State Agricultural University,10,10,280,Professor Jayashankar Telangana State Agricultural University,Agricultural Biotechnology,Plant Genetics
Madhumita Chakraborty,iim lucknow,16,18,766,Indian Institute of Management Lucknow,Operations Management,Supply Chain Management
Manas Chatterjee,"Professor and Head, Department of Dermatology, Command Hospital (Eastern Command), Kolkata 700027",22,38,1682,Command Hospital (Eastern Command),Dermatology,Skin Disorders
Mrinal K. Ghose,"Professor of Environmental Science & Engineering, Indian School of Mines, Dhanbad",43,124,6586,Indian School of Mines,Environmental Science,Environmental Engineering
Mrinal Kanti Naskar,"Professor, Jadavpur University",20,67,1987,Jadavpur University,Wireless Communication,Signal Processing
Narottam K Das,"Senior Lecturer, Central Queensland University, Melbourne Campus, Australia",27,85,2741,Central Queensland University,Information Systems,Cybersecurity
Nand K Roy,"Postdoctoral Fellow, Centre for Cancer Immunotherapy, La Jolla Institute for Immunology",23,30,3190,La Jolla Institute for Immunology,Cancer Immunotherapy,T Cell Biology
Narendra Nath Dutta,"Assistant Professor, VIT-AP University, India",12,12,271,VIT-AP University,Machine Learning,Data Science
NILOTPAL MRINAL,"Student Of B.tech Final Year At BCET,Durgapur",2,0,10,BCET Durgapur,Artificial Intelligence,Data Science
Partha Sarkar,Adj. Prof. of University of Alberta,39,86,8479,University of Alberta,Wind Engineering,Structural Dynamics
Pijush Ghosh,"Professor, Department of Applied Mechanics & Biomedical Engg, Indian Institute of Technology Madras",20,33,1476,Indian Institute of Technology Madras,Biomechanics,Biomedical Engineering
Dr PK Banerjee,"Outstanding Scientist & Outstanding Professor (AcSIR), CSIR-CIMFR Dhanbad and Ex-CTO, HINDALCO",25,50,2035,CSIR-CIMFR Dhanbad,Mineral Processing,Environmental Sustainability
"Prantik Kundu, PhD","Ceretype Neuromedicine Inc., Mount Sinai School of Medicine, Brigham and Womens Hospital, HMS",42,55,6426,Ceretype Neuromedicine Inc.,Neuroscience,Neuroimaging
Amit Singal,University of Texas Southwestern Medical Center,94,338,36414,University of Texas Southwestern Medical Center,Hepatology,Liver Cancer
AMITABH GUPTA,"Associate Professor, Dept. of Financial Studies,University of Delhi",50,206,11581,University of Delhi,Financial Management,Corporate Governance
Dr. Arvind Tiwari,"BAG Energy Research Society, India",27,38,4791,BAG Energy Research Society,Renewable Energy,Energy Storage Systems
Ashutosh Sharma,"Chemical Engineering, IITK, IIT Kanpur, Indian Institute of Technology Kanpur",89,404,26549,Indian Institute of Technology Kanpur,Polymer Science,Nanomaterials
Ashutosh Tiwari,"Civil Engg. ,Kamla Nehru Institute of Technology",80,427,30736,Kamla Nehru Institute of Technology,Structural Engineering,Geotechnical Engineering
Atul Kumar,"Assistant Professor, Baba Mastnath University",75,527,25139,Baba Mastnath University,Data Science,Artificial Intelligence
"Vinod Kumar Gupta, FWIF,FNASc, FRSC","Professor Abdulazeez University; Jedeha, Saudi Arabia;Thomson Highly Cited Researcher",202,907,141080,Professor Abdulazeez University,Environmental Chemistry,Analytical Chemistry
Vipin Kumar,"Assistant Professor of Computer Science Engineering , Women Institute of Technology Dehradun",69,576,43697,Women Institute of Technology Dehradun,Artificial Intelligence,Data Science
Dhruba Kr Bhattacharyya,"Professor of Computer Science and Engg, Tezpur University",46,131,10275,Tezpur University,Data Mining,Network Security
Dheerendra Kumar Dwivedi,"IIT ROORKEE, INDIA, PIN: 247667",48,125,6558,IIT Roorkee,Fluid Mechanics,Heat Transfer
D P Kothari,"Vice chancellor, VIT Vellore, Director I/c, IIT Delhi, Deputy Director(A),IIT Delhi,Principal,VRCE",65,238,22843,VIT Vellore,Power Systems,Renewable Energy
Dr. Pardeep Singh,Ambala College of Engineering & Applied Research Associate Professor of Mathmatics,102,597,42879,Ambala College of Engineering & Applied Research,Applied Mathematics,Numerical Analysis
Dr. VINAY  SINGH,Associate Professor Computer Science,64,395,19070,Banaras Hindu University,Artificial Intelligence,Data Mining
Devendra Choudhary,"Prof. (Associate), Govt. Engineering College, Ajmer",11,11,1183,Govt. Engineering College Ajmer,Power Systems,Renewable Energy
Peter C. Gotzsche,Institute for Scientific Freedom,111,328,413024,Institute for Scientific Freedom,Pharmaceutical Industry Ethics,Clinical Trial Transparency
Dharmendra  Mishra,Purdue University,17,27,1388,Purdue University,Cybersecurity,Data Privacy
Rajeev Agrawal,"Kumaon engineering college, G. L. Bajaj, LLoyd Institute of Engg& tech",17,35,1269,Kumaon Engineering College,Wireless Sensor Networks,Internet of Things
Girish  M. Joshi,Institute of Chemical Technology Mumbai off campus Marathwada Region-Jalna,29,69,2945,Institute of Chemical Technology Mumbai,Polymer Science,Nanomaterials
Lipsa Das,Assistant Professor,11,11,319,Indian Institute of Technology Delhi,Wireless Communication,Signal Processing
Giriraj Ratan Chandak,Former Chief Scientist and Sir JC Bose Fellow,52,115,14396,CSIR-Centre for Cellular and Molecular Biology,Genetics,Genomics
Prof. GRK SASTRY,"Professor,Department of Mechanical Engineering,National Institute of Technology Andhra Pradesh",22,112,3308,National Institute of Technology Andhra Pradesh,Mechanical Engineering,Renewable Energy
G S Gupta,Indian Institute of Science,23,41,1588,Indian Institute of Science,Fluid Mechanics,Heat Transfer
Girja Shankar Pandey,University of Zambia,20,33,1238,University of Zambia,Environmental Chemistry,Water Quality Management
H C Verma,IIT Kanpur,36,108,4884,IIT Kanpur,Theoretical Physics,Condensed Matter Physics
H C Verma,IIT Kanpur,36,108,4884,IIT Kanpur,Theoretical Physics,Astrophysics
Himanshu Narayan Singh,Memorial Sloan Kettering Cancer Center,15,20,817,Memorial Sloan Kettering Cancer Center,Cancer Biology,Precision Medicine
HARI OM GUPTA,RETIRED from DIRECTOR JIIT NOIDA and IIT ROORKEE,35,97,5758,JIIT Noida,Signal Processing,Communication Systems
Dr. Ruchika Garg,"Assistant Professor, Maharaja Agrasen University, Baddi, Solan, H.P.",3,1,29,Maharaja Agrasen University,Biotechnology,Environmental Science
Harbhajan Singh,Data Scientist,1,0,7,Data Scientist,Artificial Intelligence,Data Analytics
HARI OM GUPTA,RETIRED from DIRECTOR JIIT NOIDA and IIT ROORKEE,35,97,5758,RETIRED,Power Systems,Renewable Energy
Dr. Harsh Kumar Goyal,Administrative Officer Ministry Of Education,70,470,26336,Ministry Of Education,Educational Policy,Administrative Efficiency
Inderpreet Singh Ahuja,Professor in Mechanical Engineering,43,128,8841,Indian Institute of Technology Ropar,Sustainable Manufacturing,Additive Manufacturing
Dr.Inderjit Singh-PBG,"PAU, Ludhiana",22,52,1924,Punjab Agricultural University (PAU),Plant Breeding,Genetics
Kaushal Shetty,JP Morgan Chase,1,1,13,JP Morgan Chase,Financial Technology,Risk Management
Jay S. Yadav,"Founder and CEO, MiRus , LLC",56,143,21961,MiRus,LLC,Medical Devices
Jagdish Narain Sharma,"Professor Pediatrics, Department of Pediatrics, MAHATMA GANDHI MEDICAL COLLEGE & HOSPITAL JAIPUR",9,9,330,Mahatma Gandhi Medical College & Hospital Jaipur,Pediatrics,Child Health
JAY SHANKAR KUMAR,Research scholar,90,778,37615,Research Scholar,Artificial Intelligence,Data Science
Nathan H. Lents,Professor of Biology at John Jay College (CUNY),19,29,3076,John Jay College (CUNY),Evolutionary Biology,Human Behavior
Jitendra Kumar,Engineer at Coforge,83,778,35780,Coforge,Software Engineering,Artificial Intelligence
Joseph A Maxwell,George Mason University,53,80,85653,George Mason University,Qualitative Research,Mixed Methods Research
"Kapil Chandra Agarwal, Dr.","Former Professor at Dr. A. P. J. Abdul Kalam Technical University, Lucknow",7,5,250,Dr. A. P. J. Abdul Kalam Technical University,Power Systems,Renewable Energy
K.C Jain,"Professor in Dept.of mathematics, Malaviya national Institute of technology, Jaipur",11,14,476,Malaviya National Institute of Technology,Mathematics,Applied Mathematics
Siddharth Paliwal,BITS Pilani K.K. Birla Goa Campus,2,0,6,BITS Pilani,Operations Research,Supply Chain Management
Dr.K.K.Tripathi,"Associate Professor at the Institute of Technology, Nirma University, Ahmedabad, India",10,10,603,Nirma University,Renewable Energy Systems,Power Electronics
K L Narsimhan,visiting Professor EE IIT Bombay,34,106,4464,Indian Institute of Technology Bombay,Signal Processing,Communication Systems
Krishna Mohan Agarwal,"DNC Meerut, KNIT Sultanpur, IIT Delhi, AUUP Noida, KU Kurukshetra, IMI New Delhi",13,16,607,IIT Delhi,Fluid Mechanics,Heat Transfer
"Kunwar P. Singh, Ph.D., FAEB, FIC","Ex-Chief Scientist, CSIR-Indian Institute of Toxicology Research",71,385,29632,CSIR-Indian Institute of Toxicology Research,Toxicology,Environmental Health
Munish Chauhan,"Hoglund Biomedical Imaging Center, University of Kansas Medical Center",11,15,429,University of Kansas Medical Center,Biomedical Imaging,Neuroimaging
Jagadeesh K S,"Professor of Microbiology, University of Agricultural sciences Dharwad",16,24,1063,University of Agricultural Sciences Dharwad,Microbiology,Agricultural Sciences
Reddy K S,"Professor, Department of Mechanical Engineering, IIT Madras",56,166,11185,Indian Institute of Technology Madras,Fluid Mechanics,Heat Transfer
Lalit Mohan Patnaik,"Adjunct Professor and NASI(National Academy of Sciences India)Senior Scientist, NIAS,Bangalore,India",42,204,16771,NIAS (National Institute of Advanced Studies),Evolutionary Algorithms,Artificial Intelligence
Dr. LN Sharma,Indian Institute of Technology Guwahati,22,45,1924,Indian Institute of Technology Guwahati,Signal Processing,Biomedical Engineering
Michel Foucault,"Philosophy, Collège de France",309,1511,1403631,Collège de France,Power and Knowledge,History of Sexuality
Mahendra Chandra Joshi,National Institute of Technology Rourkela,6,5,141,National Institute of Technology Rourkela,Structural Engineering,Material Science
VARSHA TIWARI,IIT (ISM) DHANBAD,0,0,0,IIT (ISM) Dhanbad,Environmental Engineering,Water Resource Management
Manoj K Agarwal,"Professor of Marketing, Director MS Data Analytics Program, Binghamton University, State University",17,20,3284,Binghamton University,Data Analytics,Marketing Strategy
Mandeep Kumar Singh,"Amity University Gwalior and Doctor Harisingh Gour University, CSIR-SRF",4,2,121,Amity University Gwalior,Computer Science,Data Science
Manoj Kumar Gupta,"Joslin Diabetes Center, Harvard Medical School",68,412,23000,Joslin Diabetes Center,Diabetes Research,Metabolic Disorders
Dr. M.K. Jha,Purdue University,193,782,207269,Purdue University,Transportation Engineering,Infrastructure Systems
Meetu Kaushik Tiwari,Associate Research Scientist,10,10,670,University of California,San Diego,Neuroscience
Manoj Kumar Mishra,University of Calgary,30,41,3512,University of Calgary,International Relations,Security Studies
Manoj Kumar Mohanty,"AIIMS, Bhubaneswar",21,32,1694,AIIMS Bhubaneswar,Neuroscience,Neuropharmacology
Manish K. Pandey,"Principal Scientist- Genomics, Prebreeding & Bioinformatics, ICRISAT, India",63,172,12982,ICRISAT,Genomics,Bioinformatics
Manish Kumar Singh,student,66,448,21999,Indian Institute of Technology (BHU) Varanasi,Materials Science,Nanotechnology
M L Kansal,"Professor (HAG) and Ex-NEEPCO Chair & Head, WRD&M, IIT Roorkee",23,50,2877,Indian Institute of Technology Roorkee,Water Resources Development & Management,Hydropower Engineering
Murari Lal Mittal,Malaviya National Institute of Technology Jaipur,23,31,2770,Malaviya National Institute of Technology Jaipur,Structural Engineering,Concrete Technology
Dr. M. L. Munjal,"Department of Mechanical Engineering, Indian Institute of Science",39,109,8077,Indian Institute of Science,Acoustics,Noise Control
Dr.M.L. Sharma,Professor,21,45,3870,University of Delhi,Environmental Chemistry,Analytical Chemistry
Chaturvedi m.m.,"Former Senior Professor of Molecular Biology, Dept. of Zoology, university of Delhi, India",37,55,13576,University of Delhi,Molecular Biology,Zoology
Madan M. Gupta,University of Saskatchewan,79,378,47944,University of Saskatchewan,Fuzzy Systems,Neural Networks
Rajesh Pandey,"Professor and Head, Department of Biochemistry, MM Institute of Medical Sciences and Research",29,37,4830,MM Institute of Medical Sciences and Research,Biochemistry,Medical Research
Bhaskar Das,University of Minnesota,19,34,1721,University of Minnesota,Marketing,Consumer Behavior
Munishwar Nath Gupta,"Dept of Biochem. Engg & Biotechnology,IIT Delhi",63,272,16811,Indian Institute of Technology Delhi,Biochemical Engineering,Biotechnology
Jani Scandura,University of Minnesota,5,3,202,University of Minnesota,Modernist Literature,Cultural Studies
M.N.Jha,Rajendra agricultural university pusa,12,13,462,Rajendra Agricultural University Pusa,Agricultural Sciences,Crop Improvement
Ajay J Joshi,"University of Minnesota, Twin Cities",11,12,1686,University of Minnesota,Twin Cities,Computer Architecture
"Md Nuruzzaman Khan, PhD","Melbourne School of Population and Global Health, The University of Melbourne, Australia",53,112,28921,The University of Melbourne,Public Health,Global Health
Anant Mishra,"Andrew Van de Ven Professorship in Supply Chain and Operations, University of Minnesota",17,23,1511,University of Minnesota,Supply Chain Management,Operations Management
Mohan N. Rathi,"The M S University of Baroda, Vadodara",11,11,484,The M S University of Baroda,Organic Chemistry,Polymer Chemistry
"Akhilesh Pandey, M.D., Ph.D.","Professor, Laboratory Medicine and Pathology, Mayo Clinic, Rochester, Minnesota",134,773,92009,Mayo Clinic,Proteomics,Cancer Biology
Akshay Rao,"Professor of Marketing, Carlson School of Management, University of Minnesota",31,37,17122,University of Minnesota,Consumer Behavior,Pricing Strategies
Ananda Shastri,"Professor of Physics and Astronomy, Minnesota State University Moorhead",22,28,2924,Minnesota State University Moorhead,Astrophysics,Cosmology
Mayur Sharma,"Assistant Professor, Neurosurgery, University of Minnesota",36,98,4005,University of Minnesota,Neurosurgery,Brain Tumor Research
Gatikrushna Singh,University Minnesota,40,165,7809,University of Minnesota,Neuroscience,Cognitive Psychology
Jaideep Srivastava,"Professor, University of Minnesota",66,288,32489,University of Minnesota,Data Mining,Social Media Analysis
Ms Nagja Tripathi,"Institute of Pharmacy, Nirma University",4,3,134,Nirma University,Pharmaceutical Sciences,Drug Delivery Systems
Pragya Verma,University of Minnesota,22,33,3158,University of Minnesota,Computational Chemistry,Materials Science
Dr. DEEPA GARG,JNKVV RARS Sagar M.P.,5,4,241,JNKVV RARS Sagar M.P.,Agricultural Sciences,Crop Improvement
Mahesh P. Gupta,"Associate Professor and Director of Cardiothoracic Center Research Program, University of Chicago",71,295,23984,University of Chicago,Cardiothoracic Surgery,Cardiovascular Research
M P Kaushik,"PTDD, DRDE Gwalior",36,113,4361,Defence Research and Development Organisation (DRDO),Chemical Defence,Toxicology
Durgesh Kumar Mishra,"Professor of Computer Engineering and Director Microsoft Innovation Center, Sri Aurobindo Institute of Technilogy, Indore, MP, I",32,96,6489,Sri Aurobindo Institute of Technology,Computer Engineering,Microsoft Innovation Center
Dr.Akhilesh Pandey (Prof. on lien),"Chairman, M.P. Private University Regulatory commission",66,384,22713,M.P. Private University Regulatory Commission,Regulatory Policies,Higher Education Management
Dr D. S. Rathore,"Head, Dept. of Biotechnology, Govt. K.R.G.P.G. (Autonomous) College, Gwalior (M.P.) India",7,4,211,Govt. K.R.G.P.G. (Autonomous) College,Gwalior,Biotechnology
Mahendra Pal Sharma,"Professor ,Department of Hydro and Renewable Energy, IIT Roorkee, Uttarakhand, India",57,171,16107,Indian Institute of Technology Roorkee,Renewable Energy Systems,Hydropower Optimization
Munindar P Singh,"Professor of Computer Science, North Carolina State University",83,366,32610,North Carolina State University,Multiagent Systems,Service-Oriented Computing
Megh Raj Dhital,"Professor of Geology, Tri-Chandra Multiple Campus,Tribhuvan University",28,44,4781,Tribhuvan University,Geology,Environmental Geology
Mr. Rahul Gupta,"Assistant professor (Finance) Bharati vidyapeeth (Deemed to be university),  pune",37,130,17639,Bharati Vidyapeeth (Deemed to be University),Finance,Investment Analysis
Dr. Amit Jain,"Director, Global Institute of Technology & Management",86,636,57700,Global Institute of Technology & Management,Renewable Energy Systems,Sustainable Development
Manas Ranjan Mishra,"Sr Asst Professor in Mathematics, OP Jindal University",5,4,132,OP Jindal University,Mathematics,Applied Mathematics
Mr.Shrinivas chinchanikar,"Student,Nagpur institute of technology,Engineer,Real istate, Programmer,stock market",13,15,755,Nagpur Institute of Technology,Real Estate,Stock Market
Mallikarjuna Rao Pichika,Dean of Research and Professor,31,64,7160,KLE Technological University,Pharmaceutical Chemistry,Drug Discovery
Mary Reena K E,Lal Bahadur Shastri College of Engineering,3,2,68,Lal Bahadur Shastri College of Engineering,Engineering Education,Sustainable Development
Mahi R. Singh,The University of Western Ontario,41,181,7325,The University of Western Ontario,Quantum Optics,Condensed Matter Physics
Mr Ashutosh  Srivastava,"CMR Institute of Technology, Bengaluru India",10,10,256,CMR Institute of Technology,Artificial Intelligence,Data Science
Mr. Shivanshu Tripathi,Researcher,24,72,1954,Researcher,Artificial Intelligence,Data Science
Manoj Raama Varma,"Emeritus Scientist and Ex Chief Scientist, CSIR-NIIST, TVM,Professor of Physics (Magnetic Materials)",31,71,2725,CSIR-NIIST,Magnetic Materials,Physics
Dr Gaurav Agarwal MS DNB PDC FACS FISS,"Professor & Head, Endocrine & Breast Surgery, Sanjay Gandhi Postgraduate Institute of Medical",48,130,9568,Sanjay Gandhi Postgraduate Institute of Medical Sciences,Endocrine Surgery,Breast Surgery
Varad Bhatnagar,Microsoft,3,3,42,Microsoft,Artificial Intelligence,Cloud Computing
Vishrav Chaudhary,Microsoft AI,29,42,15122,Microsoft AI,Natural Language Processing,Machine Translation
Prof. M. S. Gaur,"Professor  of Physics, Hindustan College of Science and Technology, Farah ( Mathura) U P India",26,64,2448,Hindustan College of Science and Technology,Physics,Material Science
Anuradha Gupta,"Assistant Professor, The University of Mississippi",93,167,100356,The University of Mississippi,Bioorganic Chemistry,Chemical Biology
Navendu Jain,Microsoft Research,50,126,14056,Microsoft Research,Distributed Systems,Cloud Computing
Neel Joshi,"Senior Principal Research Manager, Microsoft Research",46,79,9398,Microsoft Research,Computational Imaging,Computational Photography
Kaushik Chakrabarti,Microsoft,56,111,12746,Microsoft,Data Management,Information Retrieval
ikhlas khan,"NCNPR, School of Pharmacy, Univeristy of Mississippi",95,843,49560,University of Mississippi,Natural Products,Pharmacognosy
Durgesh Kumar Mishra,"Professor of Computer Engineering and Director Microsoft Innovation Center, Sri Aurobindo Institute of Technilogy, Indore, MP, I",32,96,6489,Sri Aurobindo Institute of Technology,Computer Engineering,Microsoft Innovation Center
