"Rajesh Anand, Ph.D.","Infectious Disease Laboratory, National Institute of Immunology, New Delhi, India",11,11,445,National Institute of Immunology,Infectious Diseases,Immunotherapy
Rajesh Sundaresan,"ECE and Centre for Cyber-Physical Systems, Indian Institute of Science",26,52,2055,Indian Institute of Science,Cyber-Physical Systems,Communication Networks
Rajib Shaw,"Professor, Keio University",75,385,27542,Keio University,Disaster Risk Reduction,Climate Change Adaptation
Ramjee Gupta,IT Developer (Software engineer ),22,77,2747,IT Developer,Software Engineering,Artificial Intelligence
M.S. Ravi Sharma,University of Rhode Island,58,404,18090,University of Rhode Island,Environmental Science,Climate Change
Ravinder Kumar,"Ravinder Kumar rivravinder | Digital Marketing, Search engine optimization,  Himachal Pradesh, India",79,490,45942,Ravinder Kumar rivravinder,Digital Marketing,Search Engine Optimization
Dr. Barna Pal Mazumdar,"Asst.Prof. of Chemistry at Bhilai Mahila Mahavidyalaya, pt. Ravishankar Shukla University",20,33,978,Pt. Ravishankar Shukla University,Chemistry,Material Science
Rekha R Rapaka MD PhD,"Assistant Professor of Medicine, Center for Vaccine Development and Global Health, U. of Maryland",15,17,15744,University of Maryland,Vaccine Development,Global Health
Rohan M. Shah,Swinburne University of Technology,21,34,1911,Swinburne University of Technology,Computer Science,Data Analytics
"Rohit Srivastava, FNASc, FNAE, FAMS","Vigyan Shri 2024, SSB Prize 2021 and Himanshu Patel Chair Professor of Department BSBE",50,223,10138,Indian Institute of Technology Bombay (IIT Bombay),Biomedical Engineering,Nanotechnology
Sagnik Dey,IIT Delhi,55,141,15146,IIT Delhi,Atmospheric Science,Air Pollution
Salil Kumar Sanyal,"Professor of Electronics & Telecommunication Engineering, Jadavpur University",20,55,1580,Jadavpur University,Signal Processing,Communication Systems
SAMRAT GHOSH,Research Scholar of University of Kalyani,51,248,11296,University of Kalyani,Environmental Science,Climate Change
Dr. Sandeep Joshi,"Senior Scientific Officer, MGIRI, Ministry of MSME Govt. of India",15,21,1245,MGIRI,Ministry of MSME Govt. of India,Advanced Materials
Santanu Chaudhury,IIT Delhi,38,154,6856,Indian Institute of Technology Delhi,Computer Vision,Artificial Intelligence
Santosh Kumar Divvala,"AI2, UW",29,84,64887,University of Washington,Computer Vision,Machine Learning
Saswati Banerjee,Csir iicb,5,5,269,CSIR-IICB,Cancer Biology,Drug Discovery
SATYAM MISHRA,"Vietnam National University, Hanoi",4,3,69,Vietnam National University,Hanoi,Artificial Intelligence
Satyendra Singh Yadav,"Assistant Professor, NIT Meghalaya, India",9,9,259,NIT Meghalaya,Renewable Energy Systems,Power Electronics
Sayan Deb Dutta,"Ph.D., University of California Davis",27,57,2634,University of California Davis,Control Systems,Robotics
Shashank Priya,"Chemical Engineering and Materials Science, University of Minnesota",93,484,40814,University of Minnesota,Energy Harvesting,Piezoelectric Materials
Shivani Agrawal,Google,10,10,9586,Google,Natural Language Processing,Artificial Intelligence
Siddarth Srinivasan,Apple,15,16,2310,Apple,Human-Computer Interaction,Accessibility Technologies
Siddhant Garg,Meta,10,12,1261,Meta,Artificial Intelligence,Natural Language Processing
Siddharth Garg,"Institute Associate Professor, New York University",43,107,10444,New York University,Hardware Security,Trustworthy Machine Learning
Dr. Siddhartha Bhattacharyya,"VSB Technical University of Ostrava, Czech Republic",37,121,5644,VSB Technical University of Ostrava,Computational Intelligence,Pattern Recognition
Dr Sneha Gautam (World's Top 2% Scientist),"Associate Professor; Karunya University, India II NCTU Taiwan  II IIT KGP",40,99,5583,Karunya University,Environmental Engineering,Air Quality Management
Snigdha Chaturvedi,"Associate Professor, University of North Carolina, Chapel Hill",23,38,2297,University of North Carolina,Chapel Hill,Natural Language Processing
somayeh danesh asgari,"Ph. D. in Industrial Engineering, Iran University of Science & Technolology",3,1,39,Iran University of Science & Technology,Operations Research,Supply Chain Management
Soumyadip Chattopadhyay,Associate Professor Visva Bharati,11,12,349,Visva Bharati,Economics,Development Studies
"Sourav Banerjee, Ph.D.","Professor, Department of Mechanical Engineering, University of South Carolina",28,66,2910,University of South Carolina,Structural Health Monitoring,Advanced Materials
Sourav Sanyal,PhD Candidate @Purdue ECE,5,2,64,Purdue University,Signal Processing,Wireless Communications
Karthik Srinivas Venkataraman,"Module Development Engineer, Intel Corporation | PhD, The Pennsylvania State University",3,1,40,Intel Corporation,Module Development,Semiconductor Engineering
Deepak Srivastava,Gladstone Institutes,106,209,105589,Gladstone Institutes,Cardiovascular Disease,Stem Cell Biology
Subhadeep Chatterjee,Centre for DNA Fingerprinting and Diagnostics,22,28,2356,Centre for DNA Fingerprinting and Diagnostics,Genomics,Molecular Diagnostics
Subhasree basu,Post-doctoral Fellow,14,16,1377,Post-doctoral Fellow,University of Calcutta,Molecular Biology
Subhra Prakash Hui,"Assistant Professor, S. N. Pradhan Centre for Neurosciences, University of Calcutta",11,12,1046,University of Calcutta,Neurosciences,Neurobiology
Suchismita Chinara,National Institute of Technology Rourkela,15,20,932,National Institute of Technology Rourkela,Wireless Sensor Networks,Internet of Things
Sudhir Krishna,"National Centre for Biological Sciences, TIFR",29,50,4490,National Centre for Biological Sciences,TIFR,Cancer Biology
Sudhir Ranjan Pattanaik,NIST  University,5,5,150,NIST University,Data Science,Artificial Intelligence
Sudip Chattopadhyay,"professor of Department of Biotechnology, NIT-Durgapur",27,37,3628,National Institute of Technology Durgapur,Bioinformatics,Computational Biology
Sugata Sanyal,"Professor (Retired), Tata Institute of Fundamental Research",35,69,3982,Tata Institute of Fundamental Research,Cybersecurity,Cryptography
Sunita Sarkar,"Associate Professor, CSE, Assam University Silchar",10,10,408,Assam University Silchar,Data Mining,Artificial Intelligence
Seyed-Mohammad Fereshtehnejad,"Neurologist, Movement Disorders Clinical Fellow, Toronto Western Hospital, University of Toronto",79,226,140983,University of Toronto,Movement Disorders,Neurology
Carla Teresa Fernandez Cuadros,UCSD,47,180,183885,University of California,San Diego (UCSD),Women's Health
Udayan Roy,"Professor of Economics, Long Island University",7,6,216,Long Island University,Macroeconomics,Monetary Policy
Umesh Kumar Tiwari,"Central Scientific Instruments Organisation(CSIO), Sector 30, Chandigarh",27,49,2643,Central Scientific Instruments Organisation (CSIO),Instrumentation,Biomedical Engineering
Vaibhav Kulkarni,Data Engineering Lead @ Debiopharm,10,10,283,Debiopharm,Data Engineering,Pharmaceutical Data Analytics
Dr. Omkar Suresh Vaidya,"Sandip Institute of Technology and Research Centre, Nashik (Affiliated to Savitribai Phule Pune",9,9,157,Savitribai Phule Pune University,Industrial Engineering,Operations Research
Srinivasan Vinju Vasudevan Ph.D,"Post Doctoral Researcher -Konkuk University, Seoul, South Korea",12,12,394,Konkuk University,Artificial Intelligence,Natural Language Processing
Vipul Jain,"Reader/Associate Professor at Wellington School of Business and Government, Victoria University of",41,105,8487,Victoria University of Wellington,Sustainable Business,Corporate Social Responsibility
Vivek Kaushik,University of Illinois Urbana-Champaign,1,0,8,University of Illinois Urbana-Champaign,Molecular Biology,Cancer Research
Weilin Zhang,Institute of Tibetan Plateau Research,36,72,4111,Institute of Tibetan Plateau Research,Climate Change,Environmental Dynamics
Xiaoli Ding,Hong Kong Polytechnic University,61,289,13661,Hong Kong Polytechnic University,Geodesy,Satellite Navigation Systems
Yogesh Gupta,"Associate Professor, University of Texas Health Science Center at San Antonio, TX, USA",24,31,2134,University of Texas Health Science Center at San Antonio,Neuroscience,Pain Management
yujun zheng,Hangzhou Normal University,34,74,4529,Hangzhou Normal University,Educational Technology,Curriculum Development
Matthew Zack Anderson,"Associate Professor of Microbiology, Associate Professor of Microbial Immunity and Infection",23,33,2377,Ohio State University,Microbial Immunity,Infection Mechanisms
Abhijit Biswas,Distinguished Professor; Kmart Endowed Chair Professor; Department Chair; Wayne State University,41,53,8455,Wayne State University,Materials Science,Renewable Energy
Anurag Garg,"Indian Institute of Technology Bombay, India",30,58,2978,Indian Institute of Technology Bombay,Mechanical Engineering,Energy Systems
Asok Kumar Ghosh,"Professor, Department of Sports Science, Ramakrishna Mission Vivekananda University, Belur Math",19,28,1389,Ramakrishna Mission Vivekananda University,Sports Science,Exercise Physiology
Abhijit Chakrabarti,"Professor, Ramakrishna Mission Vivekananda Educational & Research Institute , INDIA",29,76,2278,Ramakrishna Mission Vivekananda Educational & Research Institute,Power Systems,Renewable Energy Integration
Manoj Kumar Sahu,"Associate Professor, Department of Electrical Engineering, Centre for Advanced Post Graduate Studies, Biju Patnaik University of Technology, Odisha, Rourkela-769015, India",6,6,152,Biju Patnaik University of Technology,Power Systems,Renewable Energy
CHANDAN KUMAR SWAIN,"PhD Research Scholar, Dept. of Analytical and Applied Economics, Utkal University",13,14,3486,Utkal University,Analytical Economics,Applied Economics
Debashis Ghosh,"Professor, Colorado School of Public Health",71,195,37301,University of Colorado Anschutz Medical Campus,Biostatistics,Precision Medicine
Ganesh Prasad Das,"Professor of Philosophy, Utkal University (Retd.)",1,0,2,Utkal University,Philosophy,Indian Philosophy
Gautam Das,"Distinguished University Chair Professor, Associate Dean,  University of Texas at Arlington",66,322,21748,University of Texas at Arlington,Data Mining,Big Data Analytics
Dr. Indranil Chakraborty,"Department of Chemistry, Kharagpur College",21,21,4133,Indian Institute of Technology Kharagpur,Inorganic Chemistry,Materials Science
Jayant Kumar Mohanta,"Assistant Professor, Department of Mechanical Engineering, IIT Jodhpur",7,5,270,IIT Jodhpur,Mechanical Engineering,Materials Science
Dr. Jitendra Kumar Rout,"Asst. Prof.(NIT Raipur), PhD(NIT Rourkela), MTech(NIT Rourkela), BE(UCE Burla)",15,19,1001,NIT Raipur,Data Mining,Machine Learning
Kamalakanta Mahapatra,"PROFESSOR, NIT Rourkela",30,110,3570,NIT Rourkela,Power Systems,Renewable Energy
Dr Karunakar Jha,Professor Management /Commerce & Director Corporate Affairs -Alumni Relations,5,5,77,Professor Management Institute,Commerce,Corporate Affairs
Gopal Krishna Sahu,Pt. J. N. M. Medical College,9,9,395,Pt. J. N. M. Medical College,Medical Education,Clinical Research
Krushna Chandra Patra,University of Cincinnati,16,18,4126,University of Cincinnati,Biomedical Signal Processing,Medical Imaging
Kunal Pal,National Institute of Technology Rourkela,56,193,11305,National Institute of Technology Rourkela,Biomedical Engineering,Biomaterials
Manas Kumar Das,Head & Principal Scientist,18,31,962,Indian Institute of Technology Kharagpur,Environmental Science,Climate ChangeIndian Institute of Technology Kharagpur
Manas Kumar Ghosh,Harvard University,6,3,134,Harvard University,Quantum Mechanics,Condensed Matter Physics
Manoj Kumar Gupta,"Joslin Diabetes Center, Harvard Medical School",68,412,23008,Joslin Diabetes Center,Diabetes Research,Metabolic Disorders
Dr Manoj Kumar Jena,"Lovely Professional University, Phagwara, Punjab",22,33,1898,Lovely Professional University,Artificial Intelligence,Data Science
Manoj Kumar Pradhan,Professor of Mechanical Engineering,30,125,6103,National Institute of Technology Rourkela,Manufacturing Processes,Optimization Techniques
Manoj Kumar Rout,"Asst. Professor, BIITM, Bhubaneswar",1,0,3,BIITM,Bhubaneswar,Artificial Intelligence
Manoranjan Misra,University of Utah,63,206,14015,University of Utah,Materials Science,Renewable Energy
Dr. Bhoopendra Kumar Verma,"Mohan Lal Sukhadia University, Udaipur Rajasthan (India)",6,3,184,Mohan Lal Sukhadia University,Renewable Energy,Environmental Science
Gagan Mohanty,"Professor, Department of High Energy Physics, Tata Institute of Fundamental Research",236,1384,270068,Tata Institute of Fundamental Research,High Energy Physics,Particle Physics
Dr. Nitesh S. Litoriya,"Assistant Research Scientist, Anand Agricultural University, Anand, Gujarat",8,7,193,Anand Agricultural University,Agricultural Research,Crop Improvement
Pallab Dasgupta,Indian Institute of Technology Kharagpur,21,68,2097,Indian Institute of Technology Kharagpur,Formal Verification,VLSI Design and Testing
Dr. Pankaj Kumar Mohanty,"Associate Professor, Department of Neonatology, AIIMS, Bhubaneswar",8,7,236,AIIMS Bhubaneswar,Neonatal Nutrition,Neonatal Infections
Parthasarathi Bandyopadhyay,"Post-Doctoral Researcher at Chungbuk National University, South Korea",26,42,1859,Chungbuk National University,Materials Science,Nanotechnology
Dr Prakash Kumar Sahoo,Regional Medical Research Centre Bhubaneswar,18,24,996,Regional Medical Research Centre Bhubaneswar,Infectious Diseases,Public Health
Pramod Kumar Das,Reader in Chemistry,5,4,102,North Orissa University,Organic Chemistry,Polymer Chemistry
Prasanta Kumar Mohanty,Christ University,7,3,200,Christ University,Environmental Science,Sustainable Development
Scientia Prof. Gangadhara Prusty,"Director of Research, Australian Composites Manufacturing CRC        & Director, ARC Centre for AMAC",40,138,6177,University of Southern Queensland,Advanced Composites,Additive Manufacturing
Rabindra Kumar Mohanty,Mizoram university,3,1,40,Mizoram University,Environmental Science,Biodiversity Conservation
rajkumar Misra,"DST Inspire Faculty, NIPER Mohali",14,18,435,NIPER Mohali,Drug Discovery,Pharmaceutical Sciences
Ramesh Chandra Sahoo,"Research Scholar, Centre for Nano and Soft Matter Sciences",7,5,189,Centre for Nano and Soft Matter Sciences,Nanomaterials,Soft Matter Physics
Dr. Ranjit Kumar Panda,Lecturer in physics,11,13,628,Sambalpur University,Condensed Matter Physics,Material Science
C. N. R. Rao,Professor of Chemistry,163,1209,121169,Jawaharlal Nehru Centre for Advanced Scientific Research,Materials Chemistry,Solid State Chemistry
Satish K. Tripathi,Unniversity at Buffalo,45,132,10581,University at Buffalo,Computer Science,Artificial Intelligence
Shailendra Kumar Verma,La Jolla Institute for Immunology,16,20,892,La Jolla Institute for Immunology,Immunology,Autoimmune Diseases
Samiran Panda,ICMR-Dr AS Paintal Distinguished Scientist Chair,42,110,9524,Indian Council of Medical Research (ICMR),Public Health,Epidemiology
Sandeep Kumar Jha,"Professor, Centre for Biomedical Engineering, Indian Institute of Technology Delhi, India",24,38,2439,Indian Institute of Technology Delhi,Biomedical Engineering,Medical Imaging
Dr. Sanjay Kumar Nayak,Professor of Psychology,3,2,54,KIIT University,Cognitive Psychology,Mental Health
Santosh Kumar Behera,"Scientist, NIPER-Ahmedabad,Gandhinagar",15,21,1134,NIPER-Ahmedabad,Drug Delivery Systems,Pharmaceutical Biotechnology
Saranjit Singh,Department of Pharmaceutical Analysis,64,306,18433,National Institute of Pharmaceutical Education and Research (NIPER),Pharmaceutical Analysis,Drug Development
Saswati Mishra,"Assistant professor, Malla Reddy University",5,4,522,Malla Reddy University,Data Science,Artificial Intelligence
Dr. M CHANDRA SHEKHAR NAYAK,"CSIR - Advanced Materials and Processes Research Institute (AMPRI), Bhopal, MP, IND",6,4,313,CSIR - Advanced Materials and Processes Research Institute (AMPRI),Materials Science,Sustainable Development
Dr Aparna. S Khursel,"Head & Assistant Professor, Department of Botany, Shankarlal Agrawal Science College Salekasa",1,0,2,Shankarlal Agrawal Science College Salekasa,Botany,Plant Biology
Shashank Gupta,"Associate Professor, Birla Institute of Technology and Science, Pilani, Rajasthan, India",26,47,2562,Birla Institute of Technology and Science,Pilani,Machine Learning
siba sankar mahapatra,National Institute of Technology,68,290,18991,National Institute of Technology,Power Systems,Renewable Energy
Sourav Das,university of Wisconsin madison,73,428,25866,University of Wisconsin-Madison,Astrophysics,Cosmology
Subhamoy Ganguly,University of Auckland Business School,5,4,125,University of Auckland Business School,Information Systems,Digital Innovation
Subhrajyoti Das,ICSSR Doctoral Fellow,1,0,2,Jawaharlal Nehru University,Social Sciences,Development Studies
Subrata Chowdhury,Associate Professor Department of CSE,19,30,1651,Jadavpur University,Artificial Intelligence,Data Mining
Sudarsan Ghosh,"Department of Mechanical Engineering, Indian Institute of Technology Delhi",34,66,4091,Indian Institute of Technology Delhi,Fluid Mechanics,Heat Transfer
Dr Sudarsan Sahu,Central Ground Water Board,11,11,473,Central Ground Water Board,Groundwater Management,Hydrogeology
Dr. Supriya Devi,Associate Professor in Department of Pure and Applied Mathematics,7,4,174,University of XYZ,Pure Mathematics,Applied Mathematics
Swaroop Ganguly,IIT Bombay,19,53,2215,IIT Bombay,Semiconductor Devices,Nanotechnology
Dr. Tushar Kanti Roy,"School of Engineering, Macquarie University, Australia",28,96,3124,Macquarie University,Renewable Energy Systems,Control Systems Engineering
Upendra Kumar Singh,"Professor of Mining Engineering, Indian School of Mines Dhanbad",28,73,3796,Indian Institute of Technology (Indian School of Mines) Dhanbad,Rock Mechanics,Mine Planning and Design
Utpal Kumar De,"Professor of Economics, North-Eastern Hill University, Shillong",16,30,1137,North-Eastern Hill University,Economics,Development Economics
Vasudha Aggarwal,"Johns Hopkins University, University of Illinois Urbana Champaign",10,10,603,Johns Hopkins University,Biomedical Engineering,Medical Imaging
Vikas Choudhary,Banaras Hindu University,18,24,1380,Banaras Hindu University,Medicinal Chemistry,Natural Product Chemistry
Vinod Kumar Dhiman,"Vice President, GAVS Technologies",3,0,23,GAVS Technologies,Artificial Intelligence,Data Analytics
Prof. Yogendra Kumar Jain,"Director, Samrat Ashok Technological Institute Vidisha",17,29,1324,Samrat Ashok Technological Institute Vidisha,Materials Science,Renewable Energy
Amitava Gupta,"Professor, Department of Power Engineering, Jadavpur University, Kolkata, India",23,43,2414,Jadavpur University,Power Electronics,Renewable Energy Systems
Pankaj Jalote,IIIT-Delhi,34,80,5938,IIIT-Delhi,Software Engineering,Software Quality
Sukanta kumar patra,English,13,18,577,Ravenshaw University,Postcolonial Literature,Indian English Literature
Soumen Chakrabarti,IIT Bombay,62,138,23633,IIT Bombay,Data Mining,Information Retrieval
Sourav Mukhopadhyay,"Professor, Indian Institute of Technolgy Kharagpur",28,76,3429,Indian Institute of Technology Kharagpur,Cryptography,Information Security
"Suman Kundu, Ph.D","Department of Biological Sciences, BITS Pilani, K.K. Birla Goa Campus and Department of Biochemistry",28,56,2990,BITS Pilani,Protein Folding,Structural Biology
Abhijit Das Sharma,CSIR-Central Glass & Ceramic Research Institute,23,34,1480,CSIR-Central Glass & Ceramic Research Institute,Ceramic Materials,Glass Science
ABHINAV KUMAR,Researcher & Entrepreneur,18,60,12389,Researcher & Entrepreneur,Artificial Intelligence,Data Science
Amandeep Singh,Head of the Department,56,383,15671,Punjab Agricultural University,Agricultural Economics,Sustainable Farming Practices
amar kumar,Physics,68,302,25619,Indian Institute of Technology (IIT) Kanpur,Condensed Matter Physics,Quantum Mechanics
Anil K Sharma,AICTE,57,263,16219,AICTE,Education Technology,Curriculum Development
Dr Anish Khanna,"King George's Medical University, Lucknow",9,9,614,King George's Medical University,Clinical Pharmacology,Pharmacotherapy
Dr. Anuj Kumar,"Chaudhary Charan Singh University, Meerut",43,175,7482,Chaudhary Charan Singh University,Environmental Science,Sustainable Development
Ayesha Zia,Associate Professor of Pediatrics,20,33,1760,University of Toronto,Pediatric Infectious Diseases,Vaccine Development
Mr. Rahul Gupta,"Assistant professor (Finance) Bharati vidyapeeth (Deemed to be university),  pune",37,130,17648,Bharati Vidyapeeth (Deemed to be University),Pune,Finance
Prof. (Dr.) Bhupesh Sharma,"Professor, Department of Pharmaceutical Sciences, Faculty of Life Sciences, Gurugram University",35,55,3001,Gurugram University,Pharmaceutical Sciences,Life Sciences
BRAJESH KUMAR,Student of Agra college,58,192,21309,Agra College,Environmental Science,Sustainable Agriculture
Dr. Brij Mohan Singh,College of Engineering Roorkee,29,111,4616,Indian Institute of Technology Roorkee,Structural Engineering,Geotechnical Engineering
Dibakar Roy Chowdhury,Professor,36,69,6236,Indian Institute of Technology (IIT) Delhi,Signal Processing,Wireless Communication
Dr. Dinesh Prasad,"Professor, Department of Electronics and Communication Engg, Jamia Millia Islamia",21,36,1641,Jamia Millia Islamia,Signal Processing,Communication Systems
divya sharma,student,37,127,5618,Based on available information,a specific affiliation and research interests for Professor Divya Sharma cannot be determined. If you have additional context or details,feel free to share!
Durgesh Kumar Tripathi,"Crop Nano Biology and Molecular Stress Physiology Lab, Amity University Uttar Pradesh, Noida-India",60,145,13680,Amity University Uttar Pradesh,Crop Nano Biology,Molecular Stress Physiology
Gajendra Sharma,Kathmandu University,20,31,1722,Kathmandu University,Environmental Engineering,Water Resources Management
Gaurav Goyal,"Assistant Professor, University of Alabama at Birmingham",29,67,3478,University of Alabama at Birmingham,Cancer Biology,Drug Discovery
Gaurav Gupta,Netaji Subhas Institute Of Technology,97,863,55301,Netaji Subhas Institute Of Technology,Artificial Intelligence,Data Science
Gaurav Sharma,University of Rochester,74,814,40885,University of Rochester,Data Science,Machine Learning
Goutam Rath,"Professor, Siksha O Anusandhan (Deemed to be University), Bhubaneswar, Odisha",58,137,10489,Siksha O Anusandhan (Deemed to be University),Biotechnology,Pharmaceutical Sciences
Dr. Gurdip Singh,Professor,66,398,20591,University of Greenwich,Control Systems,Intelligent Systems
Hitesh Kumar Sharma,"Professor & HoD (Cluster Head), School of Computer Science, UPES, Dehradun",24,57,2127,UPES,Data Science,Artificial Intelligence
Jai Singh,Professor of Physics and Math,64,433,20453,Indian Institute of Technology (IIT) Delhi,Quantum Mechanics,Mathematical Physics
Jainendra Jain,"Professor of Pharmacy, Ram-Eesh Institute of Vocational and Technical Education",16,27,912,Ram-Eesh Institute of Vocational and Technical Education,Pharmacy Education,Pharmaceutical Sciences
Jayant  K. Singh,"Chair Professor, Chemical Engineering, Indian Institute of Technology",42,142,6650,Indian Institute of Technology,Chemical Engineering,Molecular Simulation
Prof. (Dr.) Jayeshkumar Pitroda,"Professor of Civil Engineering Department, BVM Engineering College",27,58,2549,BVM Engineering College,Civil Engineering,Structural Analysis
Jitendra Kumar,Engineer at Coforge,83,778,35780,Coforge,Software Engineering,Artificial Intelligence
Juan Jose Hernandez Rey,"IFIC - Instituto de Física Corpuscular (CSIC and UV), Spain",182,934,207158,University of Valencia,Particle Physics,Neutrino Physics
"Professor Dr. Jyoti Prakash Tamang FNA, FNASc, FNAAS","Senior Professor, Department of Microbiology, Sikkim University",55,125,10520,Sikkim University,Fermented Foods,Microbial Diversity
Kamaljit Singh,"Professor of Chemistry, Guru Nanak Dev University, Amritsar, India",40,108,6126,Guru Nanak Dev University,Chemistry,Material Science
Kartar Singh Dhiman,Director General,16,33,1533,Director General,Environmental Science,Sustainable Development
Dr. Khushbu Gupta,Amity University Haryana,6,5,507,Amity University Haryana,Biotechnology,Environmental Science
Kuldeep Singh,"Assistant professor, Zucker School of Medicine, Staten Island University Hospital",55,347,17381,Zucker School of Medicine,Medical Education,Clinical Research
ABHINAV KUMAR,Researcher & Entrepreneur,18,60,12389,Researcher & Entrepreneur,Artificial Intelligence,Data Science
Lalit Gupta,"Professor of Electrical & Computer Engineering, Southern Illinois University, Carbondale",21,44,2072,Southern Illinois University,Carbondale,Signal Processing
Manpreet Singh,Student,66,472,23734,Student,Education Technology,Learning Analytics
Dr. Meghna Sharma,"Assistant Professor, National Institute of Technology Hamirpur",14,14,889,National Institute of Technology Hamirpur,Signal Processing,Wireless Communication
Dr. Monika Bansal,Assisant Professor,6,5,814,Assistant Professor,Optimization Techniques,Data Analytics
Dr. Namrata Gangil,"Ajay Kumar Garg Engineering College, Ghaziabad, Uttar Pradesh, India",13,17,890,Ajay Kumar Garg Engineering College,Machine Learning,Data Mining
Naresh Kumar Sharma,"Banker, Core Banking, Credit Analyst",28,94,3676,Banker,Core Banking,Credit Analysis
narendra singh,"Department of Chemistry, M.J.P. Rohilkhand University, Bareilly 243006, Uttar Pradesh, India",113,758,70826,M.J.P. Rohilkhand University,Organic Chemistry,Environmental Chemistry
Naveen Kumar,Presidency University,91,901,46988,Presidency University,Bioinformatics,Computational Biology
Navjot Singh,Research Scholar,55,297,15431,Research Scholar,Data Science,Environmental Sustainability
Neha Sharma,PhD scholar @ Sharda University,26,138,6253,Sharda University,Computer Science,Artificial Intelligence
Nisha Singh,University of Oxford,18,27,9090,University of Oxford,Quantum Computing,Nanotechnology
Nitin Kumar,SKC School & Jr. College,77,381,25636,SKC School & Jr. College,Education Technology,Curriculum Development
Pawan Kumar Netrakanti,BARC,161,754,96255,BARC,Nuclear Physics,Particle Physics
